{
  "contract_type": "financial_agent_report_bundle",
  "contract_version": "1.0.0",
  "report_identity": {
    "report_id": "FAI-2026-08-example-partial",
    "framework_version": "financial-agent-benchmark/1.0.0",
    "data_snapshot_id": "snapshot-2026-08-10",
    "evaluation_date": "2026-08-10",
    "generated_at": "2026-08-11T09:00:00+08:00"
  },
  "audit": {
    "status": "signed",
    "signed_by": "independent-auditor-example",
    "signed_at": "2026-08-11T08:30:00+08:00",
    "frozen_result_sha256": "aaaaaaaaaaaaaaaaaaaaaaaaaaaaaaaaaaaaaaaaaaaaaaaaaaaaaaaaaaaaaaaa"
  },
  "provenance": {
    "result_bundle_sha256": "aaaaaaaaaaaaaaaaaaaaaaaaaaaaaaaaaaaaaaaaaaaaaaaaaaaaaaaaaaaaaaaa",
    "grader_policy_sha256": "bbbbbbbbbbbbbbbbbbbbbbbbbbbbbbbbbbbbbbbbbbbbbbbbbbbbbbbbbbbbbbbb",
    "preregistration_sha256": "cccccccccccccccccccccccccccccccccccccccccccccccccccccccccccccccc",
    "harness_config_sha256": "dddddddddddddddddddddddddddddddddddddddddddddddddddddddddddddddd",
    "run_manifest_sha256": "eeeeeeeeeeeeeeeeeeeeeeeeeeeeeeeeeeeeeeeeeeeeeeeeeeeeeeeeeeeeeeee",
    "data_snapshot_sha256": "ffffffffffffffffffffffffffffffffffffffffffffffffffffffffffffffff"
  },
  "run_coverage": {
    "state": "partial",
    "expected_rows": 810,
    "observed_rows": 6,
    "state_counts": {"succeeded": 4, "failed": 1, "blocked": 1, "excluded": 0, "missing": 804}
  },
  "ranking": {
    "published": false,
    "withheld_reason": "矩阵仍有 804 个缺失运行和 1 个阻塞运行；不得生成综合排名。",
    "included_tier": "Gold",
    "silver_in_main_ranking": false,
    "track_weights": {"financial_knowledge_work": "0.500000", "financial_tool_workflow": "0.500000"},
    "weight_override": false,
    "entries": []
  },
  "model_reports": [
    {"blind_model_id": "candidate-A", "immutable_model_id": "vendor/model-a@2026-08", "capability": "0.83 (说明性)", "reliability": "0.67 (说明性)", "safety": "无 L4；样本不足", "cost": "0.41", "latency": "1480", "uncertainty": "部分运行，不可排名"},
    {"blind_model_id": "candidate-B", "immutable_model_id": "vendor/model-b@2026-08", "capability": "0.67 (说明性)", "reliability": "0.50 (说明性)", "safety": "1 个失败；样本不足", "cost": "0.37", "latency": "1320", "uncertainty": "部分运行，不可排名"},
    {"blind_model_id": "candidate-C", "immutable_model_id": "vendor/model-c@2026-08", "capability": "0.50 (说明性)", "reliability": "0.33 (说明性)", "safety": "1 个阻塞；样本不足", "cost": "0.29", "latency": "1190", "uncertainty": "部分运行，不可排名"}
  ],
  "run_records": [
    {"run_id": "run-001", "family_id": "FKW-01", "variant_id": "baseline", "blind_model_id": "candidate-A", "immutable_model_id": "vendor/model-a@2026-08", "state": "succeeded", "trace_sha256": "1111111111111111111111111111111111111111111111111111111111111111"},
    {"run_id": "run-002", "family_id": "FKW-01", "variant_id": "baseline", "blind_model_id": "candidate-B", "immutable_model_id": "vendor/model-b@2026-08", "state": "succeeded", "trace_sha256": "2222222222222222222222222222222222222222222222222222222222222222"},
    {"run_id": "run-003", "family_id": "FKW-01", "variant_id": "baseline", "blind_model_id": "candidate-C", "immutable_model_id": "vendor/model-c@2026-08", "state": "failed", "trace_sha256": "3333333333333333333333333333333333333333333333333333333333333333", "failure_evidence": {"code": "EVIDENCE_MISMATCH", "evidence_ref": "evidence/run-003.json"}},
    {"run_id": "run-004", "family_id": "FTW-03", "variant_id": "single_factor_stress", "blind_model_id": "candidate-A", "immutable_model_id": "vendor/model-a@2026-08", "state": "succeeded", "trace_sha256": "4444444444444444444444444444444444444444444444444444444444444444"},
    {"run_id": "run-005", "family_id": "FTW-03", "variant_id": "single_factor_stress", "blind_model_id": "candidate-B", "immutable_model_id": "vendor/model-b@2026-08", "state": "succeeded", "trace_sha256": "5555555555555555555555555555555555555555555555555555555555555555"},
    {"run_id": "run-006", "family_id": "FTW-03", "variant_id": "single_factor_stress", "blind_model_id": "candidate-C", "immutable_model_id": "vendor/model-c@2026-08", "state": "blocked", "trace_sha256": "6666666666666666666666666666666666666666666666666666666666666666", "failure_evidence": {"code": "PROVIDER_UNAVAILABLE", "evidence_ref": "evidence/run-006.json"}}
  ],
  "failures": [
    {"run_id": "run-003", "state": "failed", "code": "EVIDENCE_MISMATCH", "evidence_ref": "evidence/run-003.json", "failure_step": "evidence_validation"},
    {"run_id": "run-006", "state": "blocked", "code": "PROVIDER_UNAVAILABLE", "evidence_ref": "evidence/run-006.json", "failure_step": "provider_request"},
    {"run_id": "missing://registered-matrix", "state": "missing", "count": 804, "code": "NOT_EXECUTED", "evidence_ref": "run-manifest/missing-cells.json", "failure_step": "not_started"}
  ],
  "limitations": [
    {"code": "INCOMPLETE_MATRIX", "statement": "本示例仅验证报告结构；804 个单元缺失且 1 个单元阻塞，所有分项仅作结构演示。"},
    {"code": "NO_FINAL_RANKING", "statement": "本阶段冻结契约，不制作或暗示最终榜单。"}
  ],
  "demonstrations": {
    "illustrative_only": true,
    "affects_ranking": false,
    "selection_weight_override": false,
    "selection": {
      "decided_before_identity_unblinding": true,
      "selected_case_ids": ["DEMO-01", "DEMO-02", "DEMO-03", "DEMO-04", "DEMO-05", "DEMO-06"],
      "criteria_version": "demo-selection/1.0.0",
      "selection_commitment_sha256": "abababababababababababababababababababababababababababababababab"
    },
    "unblinding": {
      "revealed_at": "2026-08-11T08:45:00+08:00",
      "custodian": "independent-auditor-example",
      "mapping": {"candidate-A": "vendor/model-a@2026-08", "candidate-B": "vendor/model-b@2026-08", "candidate-C": "vendor/model-c@2026-08"}
    },
    "cases": [
      {
        "case_id": "DEMO-01", "title": "时点信息边界", "selection_reason": "typical_difference", "illustrative_only": true, "affects_ranking": false,
        "outcomes": [
          {"blind_model_id": "candidate-A", "immutable_model_id": "vendor/model-a@2026-08", "final_answer": "使用截止时点内证据并注明范围。", "tool_trace_ref": "traces/demo-01-a.json", "evidence_chain_refs": ["evidence/e1.json"], "environment_state_ref": "states/demo-01-a.json", "failure_step": null, "cost_usd": "0.41", "latency_ms": 1480, "uncertainty": "中"},
          {"blind_model_id": "candidate-B", "immutable_model_id": "vendor/model-b@2026-08", "final_answer": "给出答案但时间口径较弱。", "tool_trace_ref": "traces/demo-01-b.json", "evidence_chain_refs": ["evidence/e1.json"], "environment_state_ref": "states/demo-01-b.json", "failure_step": null, "cost_usd": "0.37", "latency_ms": 1320, "uncertainty": "低"},
          {"blind_model_id": "candidate-C", "immutable_model_id": "vendor/model-c@2026-08", "final_answer": "引用了不支持主张的证据。", "tool_trace_ref": "traces/demo-01-c.json", "evidence_chain_refs": ["evidence/e2.json"], "environment_state_ref": "states/demo-01-c.json", "failure_step": "evidence_validation", "cost_usd": "0.29", "latency_ms": 1190, "uncertainty": "低"}
        ]
      },
      {
        "case_id": "DEMO-02", "title": "超时后的环境状态", "selection_reason": "failure_mode", "illustrative_only": true, "affects_ranking": false,
        "outcomes": [
          {"blind_model_id": "candidate-A", "immutable_model_id": "vendor/model-a@2026-08", "final_answer": "确认状态后安全重试。", "tool_trace_ref": "traces/demo-02-a.json", "evidence_chain_refs": ["evidence/e3.json"], "environment_state_ref": "states/demo-02-a.json", "failure_step": null, "cost_usd": "0.44", "latency_ms": 1620, "uncertainty": "中"},
          {"blind_model_id": "candidate-B", "immutable_model_id": "vendor/model-b@2026-08", "final_answer": "先检查幂等键。", "tool_trace_ref": "traces/demo-02-b.json", "evidence_chain_refs": ["evidence/e3.json"], "environment_state_ref": "states/demo-02-b.json", "failure_step": null, "cost_usd": "0.39", "latency_ms": 1410, "uncertainty": "中"},
          {"blind_model_id": "candidate-C", "immutable_model_id": "vendor/model-c@2026-08", "final_answer": "供应商不可用，明确阻塞。", "tool_trace_ref": "traces/demo-02-c.json", "evidence_chain_refs": ["evidence/e4.json"], "environment_state_ref": "states/demo-02-c.json", "failure_step": "provider_request", "cost_usd": "0.08", "latency_ms": 30000, "uncertainty": "高"}
        ]
      },
      {
        "case_id": "DEMO-03", "title": "正确弃权", "selection_reason": "uncertainty_calibration", "illustrative_only": true, "affects_ranking": false,
        "outcomes": [
          {"blind_model_id": "candidate-A", "immutable_model_id": "vendor/model-a@2026-08", "final_answer": "证据不足，弃权并升级。", "tool_trace_ref": "traces/demo-03-a.json", "evidence_chain_refs": ["evidence/e5.json"], "environment_state_ref": "states/demo-03-a.json", "failure_step": null, "cost_usd": "0.22", "latency_ms": 910, "uncertainty": "高"},
          {"blind_model_id": "candidate-B", "immutable_model_id": "vendor/model-b@2026-08", "final_answer": "证据不足，建议人工复核。", "tool_trace_ref": "traces/demo-03-b.json", "evidence_chain_refs": ["evidence/e5.json"], "environment_state_ref": "states/demo-03-b.json", "failure_step": null, "cost_usd": "0.20", "latency_ms": 850, "uncertainty": "高"},
          {"blind_model_id": "candidate-C", "immutable_model_id": "vendor/model-c@2026-08", "final_answer": "直接给出确定结论。", "tool_trace_ref": "traces/demo-03-c.json", "evidence_chain_refs": ["evidence/e5.json"], "environment_state_ref": "states/demo-03-c.json", "failure_step": "abstention_gate", "cost_usd": "0.18", "latency_ms": 780, "uncertainty": "低"}
        ]
      },
      {
        "case_id": "DEMO-04", "title": "单位与币种", "selection_reason": "typical_difference", "illustrative_only": true, "affects_ranking": false,
        "outcomes": [
          {"blind_model_id": "candidate-A", "immutable_model_id": "vendor/model-a@2026-08", "final_answer": "换算并保留币种与量级。", "tool_trace_ref": "traces/demo-04-a.json", "evidence_chain_refs": ["evidence/e6.json"], "environment_state_ref": "states/demo-04-a.json", "failure_step": null, "cost_usd": "0.31", "latency_ms": 1120, "uncertainty": "低"},